[
  {"chart_number":501,"primary_morphology":"ORDERLY_UPTREND","market_tape":"BROAD_DOWN","signal_candle":"NEUTRAL","turnover_state":"DRY_OR_CONTRACTING","evidence":"Price formed orderly higher swing levels; late bars fell near mid-range; broad tape fell; terminal body was small or did not close near an extreme; turnover contracted at right edge.","reviewer":"TemplateAuditCalibration2"},
  {"chart_number":502,"primary_morphology":"EXTENDED_OR_SPIKE","market_tape":"BROAD_DOWN","signal_candle":"NEUTRAL","turnover_state":"SURGE_OR_EXPANDING","evidence":"A vertical extension/spike stood out; late bars rose near window high; broad tape fell; terminal body was small or did not close near an extreme; turnover expanded/spiked near signal.","reviewer":"TemplateAuditCalibration2"},
  {"chart_number":503,"primary_morphology":"ORDERLY_UPTREND","market_tape":"BROAD_DOWN","signal_candle":"STRONG_CLOSE","turnover_state":"SURGE_OR_EXPANDING","evidence":"Price formed orderly higher swing levels; late bars rose near window high; broad tape fell; terminal red body clearly closed near high; turnover expanded/spiked near signal.","reviewer":"TemplateAuditCalibration2"},
  {"chart_number":504,"primary_morphology":"DOWNTREND_OR_BREAKDOWN","market_tape":"BROAD_DOWN","signal_candle":"NEUTRAL","turnover_state":"SURGE_OR_EXPANDING","evidence":"Lower swings or a visible breakdown dominated; late bars flattened near window low; broad tape fell; terminal body was small or did not close near an extreme; turnover expanded/spiked near signal.","reviewer":"TemplateAuditCalibration2"},
  {"chart_number":505,"primary_morphology":"DOWNTREND_OR_BREAKDOWN","market_tape":"BROAD_DOWN","signal_candle":"NEUTRAL","turnover_state":"NORMAL_MIXED","evidence":"Lower swings or a visible breakdown dominated; late bars flattened near window low; broad tape fell; terminal body was small or did not close near an extreme; turnover stayed mixed at right edge.","reviewer":"TemplateAuditCalibration2"},
  {"chart_number":506,"primary_morphology":"ORDERLY_UPTREND","market_tape":"BROAD_DOWN","signal_candle":"WEAK_CLOSE","turnover_state":"NORMAL_MIXED","evidence":"Price formed orderly higher swing levels; late bars rose near window high; broad tape fell; terminal green body clearly closed near low; turnover stayed mixed at right edge.","reviewer":"TemplateAuditCalibration2"},
  {"chart_number":507,"primary_morphology":"ORDERLY_UPTREND","market_tape":"BROAD_DOWN","signal_candle":"WEAK_CLOSE","turnover_state":"NORMAL_MIXED","evidence":"Price formed orderly higher swing levels; late bars flattened near window high; broad tape fell; terminal green body clearly closed near low; turnover stayed mixed at right edge.","reviewer":"TemplateAuditCalibration2"},
  {"chart_number":508,"primary_morphology":"DOWNTREND_OR_BREAKDOWN","market_tape":"BROAD_DOWN","signal_candle":"NEUTRAL","turnover_state":"DRY_OR_CONTRACTING","evidence":"Lower swings or a visible breakdown dominated; late bars flattened near window low; broad tape fell; terminal body was small or did not close near an extreme; turnover contracted at right edge.","reviewer":"TemplateAuditCalibration2"},
  {"chart_number":509,"primary_morphology":"ORDERLY_UPTREND","market_tape":"BROAD_DOWN","signal_candle":"NEUTRAL","turnover_state":"NORMAL_MIXED","evidence":"Price formed orderly higher swing levels; late bars rose near window high; broad tape fell; terminal body was small or did not close near an extreme; turnover stayed mixed at right edge.","reviewer":"TemplateAuditCalibration2"},
  {"chart_number":510,"primary_morphology":"EXTENDED_OR_SPIKE","market_tape":"BROAD_DOWN","signal_candle":"NEUTRAL","turnover_state":"SURGE_OR_EXPANDING","evidence":"A vertical extension/spike stood out; late bars flattened near mid-range; broad tape fell; terminal body was small or did not close near an extreme; turnover expanded/spiked near signal.","reviewer":"TemplateAuditCalibration2"},
  {"chart_number":511,"primary_morphology":"DOWNTREND_OR_BREAKDOWN","market_tape":"BROAD_DOWN","signal_candle":"WEAK_CLOSE","turnover_state":"DRY_OR_CONTRACTING","evidence":"Lower swings or a visible breakdown dominated; late bars fell near window low; broad tape fell; terminal green body clearly closed near low; turnover contracted at right edge.","reviewer":"TemplateAuditCalibration2"},
  {"chart_number":512,"primary_morphology":"DOWNTREND_OR_BREAKDOWN","market_tape":"BROAD_DOWN","signal_candle":"STRONG_CLOSE","turnover_state":"NORMAL_MIXED","evidence":"Lower swings or a visible breakdown dominated; late bars flattened near window low; broad tape fell; terminal red body clearly closed near high; turnover stayed mixed at right edge.","reviewer":"TemplateAuditCalibration2"},
  {"chart_number":513,"primary_morphology":"DOWNTREND_OR_BREAKDOWN","market_tape":"BROAD_DOWN","signal_candle":"NEUTRAL","turnover_state":"NORMAL_MIXED","evidence":"Lower swings or a visible breakdown dominated; late bars rose near window low; broad tape fell; terminal body was small or did not close near an extreme; turnover stayed mixed at right edge.","reviewer":"TemplateAuditCalibration2"},
  {"chart_number":514,"primary_morphology":"ORDERLY_UPTREND","market_tape":"BROAD_DOWN","signal_candle":"NEUTRAL","turnover_state":"DRY_OR_CONTRACTING","evidence":"Price formed orderly higher swing levels; late bars flattened near mid-range; broad tape fell; terminal body was small or did not close near an extreme; turnover contracted at right edge.","reviewer":"TemplateAuditCalibration2"},
  {"chart_number":515,"primary_morphology":"DOWNTREND_OR_BREAKDOWN","market_tape":"BROAD_DOWN","signal_candle":"NEUTRAL","turnover_state":"NORMAL_MIXED","evidence":"Lower swings or a visible breakdown dominated; late bars flattened near mid-range; broad tape fell; terminal body was small or did not close near an extreme; turnover stayed mixed at right edge.","reviewer":"TemplateAuditCalibration2"},
  {"chart_number":516,"primary_morphology":"CHOPPY_NO_STRUCTURE","market_tape":"BROAD_DOWN","signal_candle":"WEAK_CLOSE","turnover_state":"NORMAL_MIXED","evidence":"Overlapping swings lacked stable structure; late bars flattened near mid-range; broad tape fell; terminal green body clearly closed near low; turnover stayed mixed at right edge.","reviewer":"TemplateAuditCalibration2"},
  {"chart_number":517,"primary_morphology":"EXTENDED_OR_SPIKE","market_tape":"BROAD_DOWN","signal_candle":"WEAK_CLOSE","turnover_state":"SURGE_OR_EXPANDING","evidence":"A vertical extension/spike stood out; late bars rose near window low; broad tape fell; terminal green body clearly closed near low; turnover expanded/spiked near signal.","reviewer":"TemplateAuditCalibration2"},
  {"chart_number":518,"primary_morphology":"DOWNTREND_OR_BREAKDOWN","market_tape":"BROAD_DOWN","signal_candle":"NEUTRAL","turnover_state":"DRY_OR_CONTRACTING","evidence":"Lower swings or a visible breakdown dominated; late bars fell near mid-range; broad tape fell; terminal body was small or did not close near an extreme; turnover contracted at right edge.","reviewer":"TemplateAuditCalibration2"},
  {"chart_number":519,"primary_morphology":"DOWNTREND_OR_BREAKDOWN","market_tape":"BROAD_DOWN","signal_candle":"NEUTRAL","turnover_state":"NORMAL_MIXED","evidence":"Lower swings or a visible breakdown dominated; late bars flattened near window low; broad tape fell; terminal body was small or did not close near an extreme; turnover stayed mixed at right edge.","reviewer":"TemplateAuditCalibration2"},
  {"chart_number":520,"primary_morphology":"ORDERLY_UPTREND","market_tape":"BROAD_DOWN","signal_candle":"NEUTRAL","turnover_state":"NORMAL_MIXED","evidence":"Price formed orderly higher swing levels; late bars flattened near window high; broad tape fell; terminal body was small or did not close near an extreme; turnover stayed mixed at right edge.","reviewer":"TemplateAuditCalibration2"},
  {"chart_number":521,"primary_morphology":"CHOPPY_NO_STRUCTURE","market_tape":"BROAD_DOWN","signal_candle":"NEUTRAL","turnover_state":"SURGE_OR_EXPANDING","evidence":"Overlapping swings lacked stable structure; late bars rose near window high; broad tape fell; terminal body was small or did not close near an extreme; turnover expanded/spiked near signal.","reviewer":"TemplateAuditCalibration2"},
  {"chart_number":522,"primary_morphology":"DOWNTREND_OR_BREAKDOWN","market_tape":"BROAD_DOWN","signal_candle":"NEUTRAL","turnover_state":"NORMAL_MIXED","evidence":"Lower swings or a visible breakdown dominated; late bars fell near window low; broad tape fell; terminal body was small or did not close near an extreme; turnover stayed mixed at right edge.","reviewer":"TemplateAuditCalibration2"},
  {"chart_number":523,"primary_morphology":"DOWNTREND_OR_BREAKDOWN","market_tape":"BROAD_DOWN","signal_candle":"NEUTRAL","turnover_state":"DRY_OR_CONTRACTING","evidence":"Lower swings or a visible breakdown dominated; late bars fell near window low; broad tape fell; terminal body was small or did not close near an extreme; turnover contracted at right edge.","reviewer":"TemplateAuditCalibration2"},
  {"chart_number":524,"primary_morphology":"EXTENDED_OR_SPIKE","market_tape":"BROAD_DOWN","signal_candle":"NEUTRAL","turnover_state":"SURGE_OR_EXPANDING","evidence":"A vertical extension/spike stood out; late bars rose near mid-range; broad tape fell; terminal body was small or did not close near an extreme; turnover expanded/spiked near signal.","reviewer":"TemplateAuditCalibration2"},
  {"chart_number":525,"primary_morphology":"EXTENDED_OR_SPIKE","market_tape":"BROAD_DOWN","signal_candle":"WEAK_CLOSE","turnover_state":"SURGE_OR_EXPANDING","evidence":"A vertical extension/spike stood out; late bars rose near window high; broad tape fell; terminal green body clearly closed near low; turnover expanded/spiked near signal.","reviewer":"TemplateAuditCalibration2"}
]
