[
  {
    "chart_number": 501,
    "primary_morphology": "ORDERLY_UPTREND",
    "market_tape": "BROAD_DOWN",
    "signal_candle": "NEUTRAL",
    "turnover_state": "DRY_OR_CONTRACTING",
    "evidence": "Price formed orderly higher swing levels; late bars fell near mid-range; broad tape fell; terminal body was small or did not close near an extreme; turnover contracted at right edge.",
    "reviewer": "PHASE1_BLIND_CONSENSUS"
  },
  {
    "chart_number": 502,
    "primary_morphology": "EXTENDED_OR_SPIKE",
    "market_tape": "MIXED_TRANSITION",
    "signal_candle": "WEAK_CLOSE",
    "turnover_state": "SURGE_OR_EXPANDING",
    "evidence": "A long lower range ends in a steep multi-session burst, but the final signal candle closes clearly lower on elevated turnover.",
    "reviewer": "PHASE1_BLIND_CONSENSUS"
  },
  {
    "chart_number": 503,
    "primary_morphology": "CHOPPY_NO_STRUCTURE",
    "market_tape": "BROAD_DOWN",
    "signal_candle": "STRONG_CLOSE",
    "turnover_state": "SURGE_OR_EXPANDING",
    "evidence": "Repeated spikes and reversals leave an irregular path; the signal candle rebounds with a clear body and high close as turnover expands.",
    "reviewer": "PHASE1_BLIND_CONSENSUS"
  },
  {
    "chart_number": 504,
    "primary_morphology": "DOWNTREND_OR_BREAKDOWN",
    "market_tape": "BROAD_DOWN",
    "signal_candle": "NEUTRAL",
    "turnover_state": "NORMAL_MIXED",
    "evidence": "The stock traces lower highs and lower lows before a modest late rebound; the final candle is small and turnover remains mixed.",
    "reviewer": "PHASE1_BLIND_CONSENSUS"
  },
  {
    "chart_number": 505,
    "primary_morphology": "DOWNTREND_OR_BREAKDOWN",
    "market_tape": "BROAD_DOWN",
    "signal_candle": "WEAK_CLOSE",
    "turnover_state": "DRY_OR_CONTRACTING",
    "evidence": "The early peak gives way to a sustained decline and weak low shelf; the signal candle closes clearly lower as turnover stays subdued.",
    "reviewer": "PHASE1_BLIND_CONSENSUS"
  },
  {
    "chart_number": 506,
    "primary_morphology": "CHOPPY_NO_STRUCTURE",
    "market_tape": "MIXED_TRANSITION",
    "signal_candle": "WEAK_CLOSE",
    "turnover_state": "NORMAL_MIXED",
    "evidence": "A deep decline and broad recovery form a large U-shaped reversal rather than one trend; the signal candle rejects from the late high.",
    "reviewer": "PHASE1_BLIND_CONSENSUS"
  },
  {
    "chart_number": 507,
    "primary_morphology": "ORDERLY_UPTREND",
    "market_tape": "BROAD_DOWN",
    "signal_candle": "WEAK_CLOSE",
    "turnover_state": "NORMAL_MIXED",
    "evidence": "Price formed orderly higher swing levels; late bars flattened near window high; broad tape fell; terminal green body clearly closed near low; turnover stayed mixed at right edge.",
    "reviewer": "PHASE1_BLIND_CONSENSUS"
  },
  {
    "chart_number": 508,
    "primary_morphology": "DOWNTREND_OR_BREAKDOWN",
    "market_tape": "BROAD_DOWN",
    "signal_candle": "NEUTRAL",
    "turnover_state": "DRY_OR_CONTRACTING",
    "evidence": "The old spike and upper range decay into a prolonged lower shelf; the final candle is small and recent turnover is quiet.",
    "reviewer": "PHASE1_BLIND_CONSENSUS"
  },
  {
    "chart_number": 509,
    "primary_morphology": "ORDERLY_UPTREND",
    "market_tape": "BROAD_DOWN",
    "signal_candle": "WEAK_CLOSE",
    "turnover_state": "NORMAL_MIXED",
    "evidence": "After a deep reset, the recent path advanced through persistent higher swings to a range high while the market stayed weak.",
    "reviewer": "PHASE1_BLIND_CONSENSUS"
  },
  {
    "chart_number": 510,
    "primary_morphology": "EXTENDED_OR_SPIKE",
    "market_tape": "MIXED_TRANSITION",
    "signal_candle": "NEUTRAL",
    "turnover_state": "SURGE_OR_EXPANDING",
    "evidence": "After earlier spikes, the final weeks remain in a bounded low range with little displacement; the signal candle is small despite edge turnover.",
    "reviewer": "PHASE1_BLIND_CONSENSUS"
  },
  {
    "chart_number": 511,
    "primary_morphology": "DOWNTREND_OR_BREAKDOWN",
    "market_tape": "BROAD_DOWN",
    "signal_candle": "WEAK_CLOSE",
    "turnover_state": "DRY_OR_CONTRACTING",
    "evidence": "Lower swings or a visible breakdown dominated; late bars fell near window low; broad tape fell; terminal green body clearly closed near low; turnover contracted at right edge.",
    "reviewer": "PHASE1_BLIND_CONSENSUS"
  },
  {
    "chart_number": 512,
    "primary_morphology": "DOWNTREND_OR_BREAKDOWN",
    "market_tape": "BROAD_DOWN",
    "signal_candle": "STRONG_CLOSE",
    "turnover_state": "DRY_OR_CONTRACTING",
    "evidence": "The path rolled over from a central peak into successive lower shelves; only a modest firm signal appeared while turnover stayed low.",
    "reviewer": "PHASE1_BLIND_CONSENSUS"
  },
  {
    "chart_number": 513,
    "primary_morphology": "DOWNTREND_OR_BREAKDOWN",
    "market_tape": "BROAD_DOWN",
    "signal_candle": "NEUTRAL",
    "turnover_state": "SURGE_OR_EXPANDING",
    "evidence": "A broad upper range deteriorates into lower lows before a partial late repair; the signal candle is small while turnover rises.",
    "reviewer": "PHASE1_BLIND_CONSENSUS"
  },
  {
    "chart_number": 514,
    "primary_morphology": "ORDERLY_UPTREND",
    "market_tape": "BROAD_DOWN",
    "signal_candle": "NEUTRAL",
    "turnover_state": "NORMAL_MIXED",
    "evidence": "The stock advances from a low base through higher swings and holds near the upper range; the signal candle is small and turnover elevated.",
    "reviewer": "PHASE1_BLIND_CONSENSUS"
  },
  {
    "chart_number": 515,
    "primary_morphology": "DOWNTREND_OR_BREAKDOWN",
    "market_tape": "BROAD_DOWN",
    "signal_candle": "NEUTRAL",
    "turnover_state": "DRY_OR_CONTRACTING",
    "evidence": "The early surge is followed by a sustained decline and flat low shelf; the final candle is small and turnover has contracted.",
    "reviewer": "PHASE1_BLIND_CONSENSUS"
  },
  {
    "chart_number": 516,
    "primary_morphology": "CHOPPY_NO_STRUCTURE",
    "market_tape": "BROAD_DOWN",
    "signal_candle": "WEAK_CLOSE",
    "turnover_state": "SURGE_OR_EXPANDING",
    "evidence": "Large alternating rallies and collapses dominate the path; the signal candle is a clear bearish rejection on expanding turnover.",
    "reviewer": "PHASE1_BLIND_CONSENSUS"
  },
  {
    "chart_number": 517,
    "primary_morphology": "DOWNTREND_OR_BREAKDOWN",
    "market_tape": "BROAD_DOWN",
    "signal_candle": "WEAK_CLOSE",
    "turnover_state": "SURGE_OR_EXPANDING",
    "evidence": "A completed peak-to-collapse cycle left a low base; a short-lived turnover-backed jump faded into a weak signal bar.",
    "reviewer": "PHASE1_BLIND_CONSENSUS"
  },
  {
    "chart_number": 518,
    "primary_morphology": "DOWNTREND_OR_BREAKDOWN",
    "market_tape": "BROAD_DOWN",
    "signal_candle": "NEUTRAL",
    "turnover_state": "NORMAL_MIXED",
    "evidence": "The mature advance rolls over into lower highs and a deep late drop; the final rebound candle is too small to call strong.",
    "reviewer": "PHASE1_BLIND_CONSENSUS"
  },
  {
    "chart_number": 519,
    "primary_morphology": "DOWNTREND_OR_BREAKDOWN",
    "market_tape": "BROAD_DOWN",
    "signal_candle": "NEUTRAL",
    "turnover_state": "NORMAL_MIXED",
    "evidence": "Lower swings or a visible breakdown dominated; late bars flattened near window low; broad tape fell; terminal body was small or did not close near an extreme; turnover stayed mixed at right edge.",
    "reviewer": "PHASE1_BLIND_CONSENSUS"
  },
  {
    "chart_number": 520,
    "primary_morphology": "ORDERLY_UPTREND",
    "market_tape": "BROAD_DOWN",
    "signal_candle": "NEUTRAL",
    "turnover_state": "SURGE_OR_EXPANDING",
    "evidence": "A sustained higher-low path reaches a high plateau and holds it into the signal; the final candle is small despite higher turnover.",
    "reviewer": "PHASE1_BLIND_CONSENSUS"
  },
  {
    "chart_number": 521,
    "primary_morphology": "CHOPPY_NO_STRUCTURE",
    "market_tape": "BROAD_DOWN",
    "signal_candle": "WEAK_CLOSE",
    "turnover_state": "SURGE_OR_EXPANDING",
    "evidence": "Repeated large gaps and reversals left an irregular rising-right-edge path; a weak signal followed a recent turnover spike while the market fell.",
    "reviewer": "PHASE1_BLIND_CONSENSUS"
  },
  {
    "chart_number": 522,
    "primary_morphology": "DOWNTREND_OR_BREAKDOWN",
    "market_tape": "BROAD_DOWN",
    "signal_candle": "NEUTRAL",
    "turnover_state": "DRY_OR_CONTRACTING",
    "evidence": "Price descends persistently into a fresh low range with only a tiny final lift; turnover contracts and the signal is neutral.",
    "reviewer": "PHASE1_BLIND_CONSENSUS"
  },
  {
    "chart_number": 523,
    "primary_morphology": "CHOPPY_NO_STRUCTURE",
    "market_tape": "BROAD_DOWN",
    "signal_candle": "NEUTRAL",
    "turnover_state": "DRY_OR_CONTRACTING",
    "evidence": "Lower swings or a visible breakdown dominated; late bars fell near window low; broad tape fell; terminal body was small or did not close near an extreme; turnover contracted at right edge.",
    "reviewer": "PHASE1_BLIND_CONSENSUS"
  },
  {
    "chart_number": 524,
    "primary_morphology": "EXTENDED_OR_SPIKE",
    "market_tape": "MIXED_TRANSITION",
    "signal_candle": "STRONG_CLOSE",
    "turnover_state": "SURGE_OR_EXPANDING",
    "evidence": "A long quiet range accelerates into a near-vertical terminal rally; the signal candle closes firmly near the high on surging turnover.",
    "reviewer": "PHASE1_BLIND_CONSENSUS"
  },
  {
    "chart_number": 525,
    "primary_morphology": "EXTENDED_OR_SPIKE",
    "market_tape": "BROAD_DOWN",
    "signal_candle": "WEAK_CLOSE",
    "turnover_state": "SURGE_OR_EXPANDING",
    "evidence": "A vertical extension/spike stood out; late bars rose near window high; broad tape fell; terminal green body clearly closed near low; turnover expanded/spiked near signal.",
    "reviewer": "PHASE1_BLIND_CONSENSUS"
  }
]
