[
  {
    "chart_number": 501,
    "primary_morphology": "ORDERLY_UPTREND",
    "market_tape": "MIXED_TRANSITION",
    "signal_candle": "NEUTRAL",
    "turnover_state": "NORMAL_MIXED",
    "evidence": "After the early trough, price advances through higher swings and holds a late plateau; the signal candle is small and turnover mixed.",
    "reviewer": "GalileoCalibration2"
  },
  {
    "chart_number": 502,
    "primary_morphology": "EXTENDED_OR_SPIKE",
    "market_tape": "MIXED_TRANSITION",
    "signal_candle": "WEAK_CLOSE",
    "turnover_state": "SURGE_OR_EXPANDING",
    "evidence": "A long lower range ends in a steep multi-session burst, but the final signal candle closes clearly lower on elevated turnover.",
    "reviewer": "GalileoCalibration2"
  },
  {
    "chart_number": 503,
    "primary_morphology": "CHOPPY_NO_STRUCTURE",
    "market_tape": "BROAD_DOWN",
    "signal_candle": "STRONG_CLOSE",
    "turnover_state": "SURGE_OR_EXPANDING",
    "evidence": "Repeated spikes and reversals leave an irregular path; the signal candle rebounds with a clear body and high close as turnover expands.",
    "reviewer": "GalileoCalibration2"
  },
  {
    "chart_number": 504,
    "primary_morphology": "DOWNTREND_OR_BREAKDOWN",
    "market_tape": "BROAD_DOWN",
    "signal_candle": "NEUTRAL",
    "turnover_state": "NORMAL_MIXED",
    "evidence": "The stock traces lower highs and lower lows before a modest late rebound; the final candle is small and turnover remains mixed.",
    "reviewer": "GalileoCalibration2"
  },
  {
    "chart_number": 505,
    "primary_morphology": "DOWNTREND_OR_BREAKDOWN",
    "market_tape": "BROAD_DOWN",
    "signal_candle": "WEAK_CLOSE",
    "turnover_state": "DRY_OR_CONTRACTING",
    "evidence": "The early peak gives way to a sustained decline and weak low shelf; the signal candle closes clearly lower as turnover stays subdued.",
    "reviewer": "GalileoCalibration2"
  },
  {
    "chart_number": 506,
    "primary_morphology": "CHOPPY_NO_STRUCTURE",
    "market_tape": "MIXED_TRANSITION",
    "signal_candle": "WEAK_CLOSE",
    "turnover_state": "NORMAL_MIXED",
    "evidence": "A deep decline and broad recovery form a large U-shaped reversal rather than one trend; the signal candle rejects from the late high.",
    "reviewer": "GalileoCalibration2"
  },
  {
    "chart_number": 507,
    "primary_morphology": "ORDERLY_UPTREND",
    "market_tape": "MIXED_TRANSITION",
    "signal_candle": "WEAK_CLOSE",
    "turnover_state": "NORMAL_MIXED",
    "evidence": "A low base transitions into a sustained advance and high plateau; the final candle pulls back clearly while turnover remains ordinary.",
    "reviewer": "GalileoCalibration2"
  },
  {
    "chart_number": 508,
    "primary_morphology": "DOWNTREND_OR_BREAKDOWN",
    "market_tape": "BROAD_DOWN",
    "signal_candle": "NEUTRAL",
    "turnover_state": "DRY_OR_CONTRACTING",
    "evidence": "The old spike and upper range decay into a prolonged lower shelf; the final candle is small and recent turnover is quiet.",
    "reviewer": "GalileoCalibration2"
  },
  {
    "chart_number": 509,
    "primary_morphology": "ORDERLY_UPTREND",
    "market_tape": "BROAD_DOWN",
    "signal_candle": "WEAK_CLOSE",
    "turnover_state": "SURGE_OR_EXPANDING",
    "evidence": "The latter half climbs through higher lows into the upper range, but the signal candle visibly retreats as turnover remains elevated.",
    "reviewer": "GalileoCalibration2"
  },
  {
    "chart_number": 510,
    "primary_morphology": "BASE_COMPRESSION",
    "market_tape": "MIXED_TRANSITION",
    "signal_candle": "NEUTRAL",
    "turnover_state": "SURGE_OR_EXPANDING",
    "evidence": "After earlier spikes, the final weeks remain in a bounded low range with little displacement; the signal candle is small despite edge turnover.",
    "reviewer": "GalileoCalibration2"
  },
  {
    "chart_number": 511,
    "primary_morphology": "DOWNTREND_OR_BREAKDOWN",
    "market_tape": "BROAD_DOWN",
    "signal_candle": "WEAK_CLOSE",
    "turnover_state": "NORMAL_MIXED",
    "evidence": "Overlapping swings resolve into a sharp late breakdown and only a partial bounce; the signal candle closes clearly lower.",
    "reviewer": "GalileoCalibration2"
  },
  {
    "chart_number": 512,
    "primary_morphology": "DOWNTREND_OR_BREAKDOWN",
    "market_tape": "MIXED_TRANSITION",
    "signal_candle": "STRONG_CLOSE",
    "turnover_state": "SURGE_OR_EXPANDING",
    "evidence": "The middle peak rolls into a long decline and low base, followed by a clear strong signal rebound on expanding turnover.",
    "reviewer": "GalileoCalibration2"
  },
  {
    "chart_number": 513,
    "primary_morphology": "DOWNTREND_OR_BREAKDOWN",
    "market_tape": "BROAD_DOWN",
    "signal_candle": "NEUTRAL",
    "turnover_state": "SURGE_OR_EXPANDING",
    "evidence": "A broad upper range deteriorates into lower lows before a partial late repair; the signal candle is small while turnover rises.",
    "reviewer": "GalileoCalibration2"
  },
  {
    "chart_number": 514,
    "primary_morphology": "ORDERLY_UPTREND",
    "market_tape": "BROAD_DOWN",
    "signal_candle": "NEUTRAL",
    "turnover_state": "SURGE_OR_EXPANDING",
    "evidence": "The stock advances from a low base through higher swings and holds near the upper range; the signal candle is small and turnover elevated.",
    "reviewer": "GalileoCalibration2"
  },
  {
    "chart_number": 515,
    "primary_morphology": "DOWNTREND_OR_BREAKDOWN",
    "market_tape": "BROAD_DOWN",
    "signal_candle": "NEUTRAL",
    "turnover_state": "DRY_OR_CONTRACTING",
    "evidence": "The early surge is followed by a sustained decline and flat low shelf; the final candle is small and turnover has contracted.",
    "reviewer": "GalileoCalibration2"
  },
  {
    "chart_number": 516,
    "primary_morphology": "CHOPPY_NO_STRUCTURE",
    "market_tape": "BROAD_DOWN",
    "signal_candle": "WEAK_CLOSE",
    "turnover_state": "SURGE_OR_EXPANDING",
    "evidence": "Large alternating rallies and collapses dominate the path; the signal candle is a clear bearish rejection on expanding turnover.",
    "reviewer": "GalileoCalibration2"
  },
  {
    "chart_number": 517,
    "primary_morphology": "CHOPPY_NO_STRUCTURE",
    "market_tape": "BROAD_DOWN",
    "signal_candle": "NEUTRAL",
    "turnover_state": "SURGE_OR_EXPANDING",
    "evidence": "A rise, abrupt collapse, low base, and isolated late jump create no coherent structure; the signal candle is small.",
    "reviewer": "GalileoCalibration2"
  },
  {
    "chart_number": 518,
    "primary_morphology": "DOWNTREND_OR_BREAKDOWN",
    "market_tape": "BROAD_DOWN",
    "signal_candle": "NEUTRAL",
    "turnover_state": "SURGE_OR_EXPANDING",
    "evidence": "The mature advance rolls over into lower highs and a deep late drop; the final rebound candle is too small to call strong.",
    "reviewer": "GalileoCalibration2"
  },
  {
    "chart_number": 519,
    "primary_morphology": "CHOPPY_NO_STRUCTURE",
    "market_tape": "BROAD_DOWN",
    "signal_candle": "NEUTRAL",
    "turnover_state": "SURGE_OR_EXPANDING",
    "evidence": "Wide swings and a late decline are followed by only a modest signal rebound; the candle is small and turnover elevated.",
    "reviewer": "GalileoCalibration2"
  },
  {
    "chart_number": 520,
    "primary_morphology": "ORDERLY_UPTREND",
    "market_tape": "BROAD_DOWN",
    "signal_candle": "NEUTRAL",
    "turnover_state": "SURGE_OR_EXPANDING",
    "evidence": "A sustained higher-low path reaches a high plateau and holds it into the signal; the final candle is small despite higher turnover.",
    "reviewer": "GalileoCalibration2"
  },
  {
    "chart_number": 521,
    "primary_morphology": "CHOPPY_NO_STRUCTURE",
    "market_tape": "BROAD_DOWN",
    "signal_candle": "WEAK_CLOSE",
    "turnover_state": "NORMAL_MIXED",
    "evidence": "Several deep reversals leave an irregular path; the signal candle shows a clear bearish body and closes near its low.",
    "reviewer": "GalileoCalibration2"
  },
  {
    "chart_number": 522,
    "primary_morphology": "DOWNTREND_OR_BREAKDOWN",
    "market_tape": "BROAD_DOWN",
    "signal_candle": "NEUTRAL",
    "turnover_state": "DRY_OR_CONTRACTING",
    "evidence": "Price descends persistently into a fresh low range with only a tiny final lift; turnover contracts and the signal is neutral.",
    "reviewer": "GalileoCalibration2"
  },
  {
    "chart_number": 523,
    "primary_morphology": "CHOPPY_NO_STRUCTURE",
    "market_tape": "MIXED_TRANSITION",
    "signal_candle": "NEUTRAL",
    "turnover_state": "NORMAL_MIXED",
    "evidence": "Multiple gaps, spikes, and reversals overlap without a stable trend; the final candle is small and turnover mixed.",
    "reviewer": "GalileoCalibration2"
  },
  {
    "chart_number": 524,
    "primary_morphology": "EXTENDED_OR_SPIKE",
    "market_tape": "MIXED_TRANSITION",
    "signal_candle": "STRONG_CLOSE",
    "turnover_state": "SURGE_OR_EXPANDING",
    "evidence": "A long quiet range accelerates into a near-vertical terminal rally; the signal candle closes firmly near the high on surging turnover.",
    "reviewer": "GalileoCalibration2"
  },
  {
    "chart_number": 525,
    "primary_morphology": "ORDERLY_UPTREND",
    "market_tape": "BROAD_DOWN",
    "signal_candle": "WEAK_CLOSE",
    "turnover_state": "SURGE_OR_EXPANDING",
    "evidence": "The late path advances in a sustained staircase from a long base, but the final signal candle closes clearly lower on high turnover.",
    "reviewer": "GalileoCalibration2"
  }
]

