[
  {"chart_number": 1, "primary_morphology": "CHOPPY_NO_STRUCTURE", "market_tape": "BROAD_DOWN", "signal_candle": "NEUTRAL", "turnover_state": "NORMAL_MIXED", "evidence": "A strong middle advance reverses into a sustained late decline; the market line falls and recent turnover is ordinary.", "reviewer": "RootCalibration"},
  {"chart_number": 2, "primary_morphology": "EXTENDED_OR_SPIKE", "market_tape": "BROAD_DOWN", "signal_candle": "NEUTRAL", "turnover_state": "NORMAL_MIXED", "evidence": "A long uneven base gives way to a steep late advance near the signal while the broad line trends down.", "reviewer": "RootCalibration"},
  {"chart_number": 3, "primary_morphology": "ORDERLY_UPTREND", "market_tape": "BROAD_DOWN", "signal_candle": "NEUTRAL", "turnover_state": "SURGE_OR_EXPANDING", "evidence": "Price forms a persistent rising staircase despite a falling market line, with visibly heavier turnover into the late window.", "reviewer": "RootCalibration"},
  {"chart_number": 4, "primary_morphology": "DOWNTREND_OR_BREAKDOWN", "market_tape": "BROAD_DOWN", "signal_candle": "STRONG_CLOSE", "turnover_state": "NORMAL_MIXED", "evidence": "After an early spike, price makes a long lower path and only a small late recovery; the broad line also falls.", "reviewer": "RootCalibration"},
  {"chart_number": 5, "primary_morphology": "ORDERLY_UPTREND", "market_tape": "BROAD_DOWN", "signal_candle": "NEUTRAL", "turnover_state": "SURGE_OR_EXPANDING", "evidence": "Successive higher swing zones persist into the signal while the market declines; late turnover expands from the early baseline.", "reviewer": "RootCalibration"},
  {"chart_number": 6, "primary_morphology": "CHOPPY_NO_STRUCTURE", "market_tape": "BROAD_DOWN", "signal_candle": "NEUTRAL", "turnover_state": "NORMAL_MIXED", "evidence": "Several large alternating rises and declines leave price near a renewed upswing rather than a stable trend; market direction is down.", "reviewer": "RootCalibration"},
  {"chart_number": 7, "primary_morphology": "DOWNTREND_OR_BREAKDOWN", "market_tape": "BROAD_DOWN", "signal_candle": "NEUTRAL", "turnover_state": "SURGE_OR_EXPANDING", "evidence": "A late sharp breakdown interrupts a sideways path and is followed only by a low base; turnover jumps around the break.", "reviewer": "RootCalibration"},
  {"chart_number": 8, "primary_morphology": "CHOPPY_NO_STRUCTURE", "market_tape": "BROAD_DOWN", "signal_candle": "NEUTRAL", "turnover_state": "NORMAL_MIXED", "evidence": "An isolated early surge fades into broad oscillation with no persistent direction; both market and late price soften.", "reviewer": "RootCalibration"},
  {"chart_number": 9, "primary_morphology": "CHOPPY_NO_STRUCTURE", "market_tape": "BROAD_DOWN", "signal_candle": "STRONG_CLOSE", "turnover_state": "SURGE_OR_EXPANDING", "evidence": "Price falls from an early range, bottoms, then rebounds unevenly into a strong final bar as turnover increases.", "reviewer": "RootCalibration"},
  {"chart_number": 10, "primary_morphology": "EXTENDED_OR_SPIKE", "market_tape": "BROAD_DOWN", "signal_candle": "NEUTRAL", "turnover_state": "SURGE_OR_EXPANDING", "evidence": "A long flat base transitions abruptly into a steep late markup with heavy turnover while the broad line remains weak.", "reviewer": "RootCalibration"},
  {"chart_number": 11, "primary_morphology": "EXTENDED_OR_SPIKE", "market_tape": "BROAD_DOWN", "signal_candle": "WEAK_CLOSE", "turnover_state": "SURGE_OR_EXPANDING", "evidence": "A near-parabolic late advance ends with a pullback at the signal; turnover is much heavier than during the early base.", "reviewer": "RootCalibration"},
  {"chart_number": 12, "primary_morphology": "ORDERLY_UPTREND", "market_tape": "MIXED_TRANSITION", "signal_candle": "NEUTRAL", "turnover_state": "SURGE_OR_EXPANDING", "evidence": "A rising multi-stage path culminates near a new high; the market line changes direction and late turnover is elevated.", "reviewer": "RootCalibration"},
  {"chart_number": 13, "primary_morphology": "CHOPPY_NO_STRUCTURE", "market_tape": "MIXED_TRANSITION", "signal_candle": "STRONG_CLOSE", "turnover_state": "SURGE_OR_EXPANDING", "evidence": "Large alternating swings end in a sharp signal-time recovery; market direction transitions and late turnover expands.", "reviewer": "RootCalibration"},
  {"chart_number": 14, "primary_morphology": "EXTENDED_OR_SPIKE", "market_tape": "MIXED_TRANSITION", "signal_candle": "NEUTRAL", "turnover_state": "SURGE_OR_EXPANDING", "evidence": "A quiet declining base is followed by an abrupt late vertical advance with concentrated heavy turnover.", "reviewer": "RootCalibration"},
  {"chart_number": 15, "primary_morphology": "DOWNTREND_OR_BREAKDOWN", "market_tape": "BROAD_DOWN", "signal_candle": "STRONG_CLOSE", "turnover_state": "SURGE_OR_EXPANDING", "evidence": "Price remains structurally below an early high and volatile near its lows, ending with a large recovery bar and turnover burst.", "reviewer": "RootCalibration"},
  {"chart_number": 16, "primary_morphology": "ORDERLY_UPTREND", "market_tape": "BROAD_DOWN", "signal_candle": "NEUTRAL", "turnover_state": "NORMAL_MIXED", "evidence": "Price advances through several higher plateaus before a controlled late pullback, contrasting with a declining market line.", "reviewer": "RootCalibration"},
  {"chart_number": 17, "primary_morphology": "ORDERLY_UPTREND", "market_tape": "MIXED_TRANSITION", "signal_candle": "NEUTRAL", "turnover_state": "NORMAL_MIXED", "evidence": "Despite several pullbacks, the path builds higher zones and finishes near the upper range while the market line changes direction.", "reviewer": "RootCalibration"},
  {"chart_number": 18, "primary_morphology": "ORDERLY_UPTREND", "market_tape": "BROAD_UP", "signal_candle": "WEAK_CLOSE", "turnover_state": "NORMAL_MIXED", "evidence": "Price recovers from an early dip into persistent higher levels, then pulls back modestly as the broad line rises overall.", "reviewer": "RootCalibration"},
  {"chart_number": 19, "primary_morphology": "CHOPPY_NO_STRUCTURE", "market_tape": "BROAD_DOWN", "signal_candle": "STRONG_CLOSE", "turnover_state": "NORMAL_MIXED", "evidence": "Wide alternating swings and a long middle decline end in a rebound, with no stable directional structure and a weak market.", "reviewer": "RootCalibration"},
  {"chart_number": 20, "primary_morphology": "CHOPPY_NO_STRUCTURE", "market_tape": "BROAD_DOWN", "signal_candle": "NEUTRAL", "turnover_state": "NORMAL_MIXED", "evidence": "An early rebound and middle high give way to an uneven late decline; the broad market line trends down.", "reviewer": "RootCalibration"},
  {"chart_number": 21, "primary_morphology": "DOWNTREND_OR_BREAKDOWN", "market_tape": "MIXED_TRANSITION", "signal_candle": "WEAK_CLOSE", "turnover_state": "DRY_OR_CONTRACTING", "evidence": "The available history is short and begins with a persistent decline before a partial rebound; many earlier slots are blank.", "reviewer": "RootCalibration"},
  {"chart_number": 22, "primary_morphology": "CHOPPY_NO_STRUCTURE", "market_tape": "BROAD_DOWN", "signal_candle": "NEUTRAL", "turnover_state": "NORMAL_MIXED", "evidence": "A mostly sideways path contains an isolated deep break and several reversals, while the market line trends lower.", "reviewer": "RootCalibration"},
  {"chart_number": 23, "primary_morphology": "EXTENDED_OR_SPIKE", "market_tape": "BROAD_DOWN", "signal_candle": "WEAK_CLOSE", "turnover_state": "NORMAL_MIXED", "evidence": "A late steep run reaches an isolated peak and then retreats into the signal while the broad market continues lower.", "reviewer": "RootCalibration"},
  {"chart_number": 24, "primary_morphology": "CHOPPY_NO_STRUCTURE", "market_tape": "BROAD_DOWN", "signal_candle": "NEUTRAL", "turnover_state": "NORMAL_MIXED", "evidence": "Repeated large rises and declines produce no stable trend; the final rebound remains below earlier peaks in a falling market.", "reviewer": "RootCalibration"},
  {"chart_number": 25, "primary_morphology": "DOWNTREND_OR_BREAKDOWN", "market_tape": "BROAD_DOWN", "signal_candle": "STRONG_CLOSE", "turnover_state": "SURGE_OR_EXPANDING", "evidence": "Price trends down through most of the window and finishes with a sharp recovery bar accompanied by visibly higher turnover.", "reviewer": "RootCalibration"}
]
